name,PMID,corresponding_author,university,department,abstract
Word usage in spontaneous speech as a predictor of depressive symptoms among youth at high risk for mood disorders.,36528134,David J Miklowitz,UCLA Semel Institute for Neuroscience and Human Behavior,N/A,"We examined whether digital phenotyping of spontaneous speech, such as the use of specific word categories during speech samples, was associated with depressive symptoms in youth who were at familial and clinical risk for mood disorders. Participants (ages 13-19) had active mood symptoms, mood instability, and at least one parent with bipolar or major depressive disorder. During a randomized trial of family-focused therapy, participants were instructed to make weekly calls to a central voice server and leave speech samples in response to automated prompts. We coded youths' speech samples with the Linguistic Inquiry and Word Count system and used machine learning to identify the combination of speech features that were most closely associated with the course of depressive symptoms over 18 weeks. A total of 253 speech samples were collected from 44 adolescents (mean age = 15.8 years; SD = 1.6) over 18 weeks. Speech containing affective processes, social processes, drives toward risk or reward, nonfluencies, and time orientation words were correlated with depressive symptoms at concurrent time periods (ps < 0.01). Machine learning analyses revealed that affective processes, nonfluencies, drives and risk words combined to most strongly predict changes in depressive symptoms over 18 weeks of treatment. Study results were limited by the small sample and the exclusion of paralinguistic or contextual variables in analyzing speech samples. In youth at high risk for mood disorders, knowledge of speech patterns may inform prognoses during outpatient psychosocial treatment."
Detection of Suicidality Among Opioid Users on Reddit: Machine Learning-Based Approach.,33245287,Fusheng Wang,Stony Brook University,N/A,"In recent years, both suicide and overdose rates have been increasing. Many individuals who struggle with opioid use disorder are prone to suicidal ideation; this may often result in overdose. However, these fatal overdoses are difficult to classify as intentional or unintentional. Intentional overdose is difficult to detect, partially due to the lack of predictors and social stigmas that push individuals away from seeking help. These individuals may instead use web-based means to articulate their concerns. This study aimed to extract posts of suicidality among opioid users on Reddit using machine learning methods. The performance of the models is derivative of the data purity, and the results will help us to better understand the rationale of these users, providing new insights into individuals who are part of the opioid epidemic. Reddit posts between June 2017 and June 2018 were collected from r/suicidewatch, r/depression, a set of opioid-related subreddits, and a control subreddit set. We first classified suicidal versus nonsuicidal languages and then classified users with opioid usage versus those without opioid usage. Several traditional baselines and neural network (NN) text classifiers were trained using subreddit names as the labels and combinations of semantic inputs. We then attempted to extract out-of-sample data belonging to the intersection of suicide ideation and opioid abuse. Amazon Mechanical Turk was used to provide labels for the out-of-sample data. Classification results were at least 90% across all models for at least one combination of input; the best classifier was convolutional neural network, which obtained an F<sub>1</sub> score of 96.6%. When predicting out-of-sample data for posts containing both suicidal ideation and signs of opioid addiction, NN classifiers produced more false positives and traditional methods produced more false negatives, which is less desirable for predicting suicidal sentiments. Opioid abuse is linked to the risk of unintentional overdose and suicide risk. Social media platforms such as Reddit contain metadata that can aid machine learning and provide information at a personal level that cannot be obtained elsewhere. We demonstrate that it is possible to use NNs as a tool to predict an out-of-sample target with a model built from data sets labeled by characteristics we wish to distinguish in the out-of-sample target."
Personalized Prediction of Response to Smartphone-Delivered Meditation Training: Randomized Controlled Trial.,36346668,Simon B Goldberg,University of Wisconsin - Madison,Center for Healthy Minds,"Meditation apps have surged in popularity in recent years, with an increasing number of individuals turning to these apps to cope with stress, including during the COVID-19 pandemic. Meditation apps are the most commonly used mental health apps for depression and anxiety. However, little is known about who is well suited to these apps. This study aimed to develop and test a data-driven algorithm to predict which individuals are most likely to benefit from app-based meditation training. Using randomized controlled trial data comparing a 4-week meditation app (Healthy Minds Program [HMP]) with an assessment-only control condition in school system employees (n=662), we developed an algorithm to predict who is most likely to benefit from HMP. Baseline clinical and demographic characteristics were submitted to a machine learning model to develop a ""Personalized Advantage Index"" (PAI) reflecting an individual's expected reduction in distress (primary outcome) from HMP versus control. A significant group × PAI interaction emerged (t<sub>658</sub>=3.30; P=.001), indicating that PAI scores moderated group differences in outcomes. A regression model that included repetitive negative thinking as the sole baseline predictor performed comparably well. Finally, we demonstrate the translation of a predictive model into personalized recommendations of expected benefit. Overall, the results revealed the potential of a data-driven algorithm to inform which individuals are most likely to benefit from a meditation app. Such an algorithm could be used to objectively communicate expected benefits to individuals, allowing them to make more informed decisions about whether a meditation app is appropriate for them. ClinicalTrials.gov NCT04426318; https://clinicaltrials.gov/ct2/show/NCT04426318."
Who will respond to intensive PTSD treatment? A machine learning approach to predicting response prior to starting treatment.,35468429,Dale L Smith,Rush University Medical Center,Department of Psychiatry and Behavioral Sciences,"Despite the established effectiveness of evidence-based PTSD treatments, not everyone responds the same. Specifically, some individuals respond early while others respond minimally throughout treatment. Our ability to predict these trajectories at baseline has been limited. Predicting which individuals will respond to a certain type of treatment can significantly reduce short- and long-term costs and increase the ability to preemptively match individuals with treatments to which they are most likely to respond. In the present study, we examined whether veterans' responses to a 3-week Cognitive Processing Therapy-based intensive PTSD treatment program could be accurately predicted prior to the first session. Using a sample of 432 veterans, and a wide range of demographic and clinical data collected during intake, we assessed six machine learning and statistical methods and their ability to predict fast and minimal responders prior to treatment initiation. For fast response classification, gradient boosted models (GBM) had the highest AUC-PR (0.466). For minimal response classification, elastic net (EN) had the highest mean CV AUC-PR (0.628). Using the best performing classifiers, we were able to predict both fast and minimal responders prior to starting treatment with relatively high AUC-ROC of 0.765 (GBM) and 0.826 (EN), respectively. These results may inform treatment modifications, although the accuracy may not be sufficient for clinicians to base inclusion/exclusion decisions entirely on the classifiers. Future research should evaluate whether these classifiers can be expanded to predict to which treatment type(s) an individual is most likely to respond based on various clinical, circumstantial, and biological features."
From promise to practice: towards the realisation of AI-informed mental health care.,36229346,Munmun De Choudhury,Georgia Institute of Technology,School of Interactive Computing,"In this Series paper, we explore the promises and challenges of artificial intelligence (AI)-based precision medicine tools in mental health care from clinical, ethical, and regulatory perspectives. The real-world implementation of these tools is increasingly considered the prime solution for key issues in mental health, such as delayed, inaccurate, and inefficient care delivery. Similarly, machine-learning-based empirical strategies are becoming commonplace in psychiatric research because of their potential to adequately deconstruct the biopsychosocial complexity of mental health disorders, and hence to improve nosology of prognostic and preventive paradigms. However, the implementation steps needed to translate these promises into practice are currently hampered by multiple interacting challenges. These obstructions range from the current technology-distant state of clinical practice, over the lack of valid real-world databases required to feed data-intensive AI algorithms, to model development and validation considerations being disconnected from the core principles of clinical utility and ethical acceptability. In this Series paper, we provide recommendations on how these challenges could be addressed from an interdisciplinary perspective to pave the way towards a framework for mental health care, leveraging the combined strengths of human intelligence and AI."
An electroencephalographic signature predicts antidepressant response in major depression.,32042166,Amit Etkin,Stanford University,Department of Psychiatry and Behavioral Sciences,"Antidepressants are widely prescribed, but their efficacy relative to placebo is modest, in part because the clinical diagnosis of major depression encompasses biologically heterogeneous conditions. Here, we sought to identify a neurobiological signature of response to antidepressant treatment as compared to placebo. We designed a latent-space machine-learning algorithm tailored for resting-state electroencephalography (EEG) and applied it to data from the largest imaging-coupled, placebo-controlled antidepressant study (n = 309). Symptom improvement was robustly predicted in a manner both specific for the antidepressant sertraline (versus placebo) and generalizable across different study sites and EEG equipment. This sertraline-predictive EEG signature generalized to two depression samples, wherein it reflected general antidepressant medication responsivity and related differentially to a repetitive transcranial magnetic stimulation treatment outcome. Furthermore, we found that the sertraline resting-state EEG signature indexed prefrontal neural responsivity, as measured by concurrent transcranial magnetic stimulation and EEG. Our findings advance the neurobiological understanding of antidepressant treatment through an EEG-tailored computational model and provide a clinical avenue for personalized treatment of depression."
Using machine learning with intensive longitudinal data to predict depression and suicidal ideation among medical interns over time.,36177889,Ewa K Czyz,University of Michigan,Department of Psychiatry,"Use of intensive longitudinal methods (e.g. ecological momentary assessment, passive sensing) and machine learning (ML) models to predict risk for depression and suicide has increased in recent years. However, these studies often vary considerably in length, ML methods used, and sources of data. The present study examined predictive accuracy for depression and suicidal ideation (SI) as a function of time, comparing different combinations of ML methods and data sources. Participants were 2459 first-year training physicians (55.1% female; 52.5% White) who were provided with Fitbit wearable devices and assessed daily for mood. Linear [elastic net regression (ENR)] and non-linear (random forest) ML algorithms were used to predict depression and SI at the first-quarter follow-up assessment, using two sets of variables (daily mood features only, daily mood features + passive-sensing features). To assess accuracy over time, models were estimated iteratively for each of the first 92 days of internship, using data available up to that point in time. ENRs using only the daily mood features generally had the best accuracy for predicting mental health outcomes, and predictive accuracy within 1 standard error of the full 92 day models was attained by weeks 7-8. Depression at 92 days could be predicted accurately (area under the curve >0.70) after only 14 days of data collection. Simpler ML methods may outperform more complex methods until passive-sensing features become better specified. For intensive longitudinal studies, there may be limited predictive value in collecting data for more than 2 months."
"Impact of online mental health screening tools on help-seeking, care receipt, and suicidal ideation and suicidal intent: Evidence from internet search behavior in a large U.S. cohort.",33199054,Paul J Barr,Dartmouth College,Center for Technology and Behavioral Health,"Most people with psychiatric illnesses do not receive treatment for almost a decade after disorder onset. Online mental health screens reflect one mechanism designed to shorten this lag in help-seeking, yet there has been limited research on the effectiveness of screening tools in naturalistic settings. We examined a cohort of persons directed to a mental health screening tool via the Bing search engine (n = 126,060). We evaluated the impact of tool content on later searches for mental health self-references, self-diagnosis, care seeking, psychoactive medications, suicidal ideation, and suicidal intent. Website characteristics were evaluated by pairs of independent raters to ascertain screen type and content. These included the presence/absence of a suggestive diagnosis, a message on interpretability, as well as referrals to digital treatments, in-person treatments, and crisis services. Using machine learning models, the results suggested that screen content predicted later searches with mental health self-references (AUC = 0·73), mental health self-diagnosis (AUC = 0·69), mental health care seeking (AUC = 0·61), psychoactive medications (AUC = 0·55), suicidal ideation (AUC = 0·58), and suicidal intent (AUC = 0·60). Cox-proportional hazards models suggested individuals utilizing tools with in-person care referral were significantly more likely to subsequently search for methods to actively end their life (HR = 1·727, p = 0·007). Online screens may influence help-seeking behavior, suicidal ideation, and suicidal intent. Websites with referrals to in-person treatments could put persons at greater risk of active suicidal intent. Further evaluation using large-scale randomized controlled trials is needed."
The signature-testing approach to mapping biological and artificial intelligences.,35773138,Colin Allen,University of Pittsburgh,Department of History and Philosophy of Science,"Making inferences from behaviour to cognition is problematic due to a many-to-one mapping problem, in which any one behaviour can be generated by multiple possible cognitive processes. Attempts to cross this inferential gap when comparing human intelligence to that of animals or machines can generate great debate. Here, we discuss the challenges of making comparisons using 'success-testing' approaches and call attention to an alternate experimental framework, the 'signature-testing' approach. Signature testing places the search for information-processing errors, biases, and other patterns centre stage, rather than focussing predominantly on problem-solving success. We highlight current research on both biological and artificial intelligence that fits within this framework and is creating proactive research programs that make strong inferences about the similarities and differences between the content of human, animal, and machine minds."
Prediction of the trajectories of depressive symptoms among children in the adolescent brain cognitive development (ABCD) study using machine learning approach.,35545159,Xiaobo Zhou,University of Texas Health Science Center at Houston,School of Biomedical Informatics,"Depression often first emerges during adolescence and evidence shows that the long-term patterns of depressive symptoms over time are heterogeneous. It is meaningful to predict the trajectory of depressive symptoms in adolescents to find early intervention targets. Based on the Adolescent Brain Cognitive Development Study, we included 4962 participants aged 9-10 who were followed-up for 2 years. Trajectories of depressive symptoms were identified by Latent Class Growth Analyses (LCGA). Four types of machine learning models were built to predict the identified trajectories and to obtain variables with predictive value based on the best performance model. Of all participants, 536 (10.80%) were classified as increasing, 269 (5.42%) as persistently high, 433 (8.73%) as decreasing, and 3724 (75.05%) as persistently low by LCGA. Gradient Boosting Machine (GBM) model got the highest discriminant performance. Sleep quality, parental emotional state and family financial adversities were the most important predictors and three resting state functional magnetic resonance imaging functional connectivity data were also helpful to distinguish trajectories. We only have depressive symptom scores at three time points. Some valuable predictors are not specific to depression. External validation is an important next step. These predictors should not be interpreted as etiology and some variables were reported by parents/caregivers. Using GBM combined with baseline characteristics, the trajectories of depressive symptoms with two years among adolescents aged 9-10 years can be well predicted, which might further facilitate the identification of adolescents at high risk of depressive symptoms and development of effective early interventions."
Evaluation of an artificial intelligence-based medical device for diagnosis of autism spectrum disorder.,35513550,Sharief Taraman,CHOC Children's,N/A,"Autism spectrum disorder (ASD) can be reliably diagnosed at 18 months, yet significant diagnostic delays persist in the United States. This double-blinded, multi-site, prospective, active comparator cohort study tested the accuracy of an artificial intelligence-based Software as a Medical Device designed to aid primary care healthcare providers (HCPs) in diagnosing ASD. The Device combines behavioral features from three distinct inputs (a caregiver questionnaire, analysis of two short home videos, and an HCP questionnaire) in a gradient boosted decision tree machine learning algorithm to produce either an ASD positive, ASD negative, or indeterminate output. This study compared Device outputs to diagnostic agreement by two or more independent specialists in a cohort of 18-72-month-olds with developmental delay concerns (425 study completers, 36% female, 29% ASD prevalence). Device output PPV for all study completers was 80.8% (95% confidence intervals (CI), 70.3%-88.8%) and NPV was 98.3% (90.6%-100%). For the 31.8% of participants who received a determinate output (ASD positive or negative) Device sensitivity was 98.4% (91.6%-100%) and specificity was 78.9% (67.6%-87.7%). The Device's indeterminate output acts as a risk control measure when inputs are insufficiently granular to make a determinate recommendation with confidence. If this risk control measure were removed, the sensitivity for all study completers would fall to 51.6% (63/122) (95% CI 42.4%, 60.8%), and specificity would fall to 18.5% (56/303) (95% CI 14.3%, 23.3%). Among participants for whom the Device abstained from providing a result, specialists identified that 91% had one or more complex neurodevelopmental disorders. No significant differences in Device performance were found across participants' sex, race/ethnicity, income, or education level. For nearly a third of this primary care sample, the Device enabled timely diagnostic evaluation with a high degree of accuracy. The Device shows promise to significantly increase the number of children able to be diagnosed with ASD in a primary care setting, potentially facilitating earlier intervention and more efficient use of specialist resources."
"Impact of online mental health screening tools on help-seeking, care receipt, and suicidal ideation and suicidal intent: Evidence from internet search behavior in a large U.S. cohort.",33199054,Paul J Barr,Dartmouth College,Center for Technology and Behavioral Health,"Most people with psychiatric illnesses do not receive treatment for almost a decade after disorder onset. Online mental health screens reflect one mechanism designed to shorten this lag in help-seeking, yet there has been limited research on the effectiveness of screening tools in naturalistic settings. We examined a cohort of persons directed to a mental health screening tool via the Bing search engine (n = 126,060). We evaluated the impact of tool content on later searches for mental health self-references, self-diagnosis, care seeking, psychoactive medications, suicidal ideation, and suicidal intent. Website characteristics were evaluated by pairs of independent raters to ascertain screen type and content. These included the presence/absence of a suggestive diagnosis, a message on interpretability, as well as referrals to digital treatments, in-person treatments, and crisis services. Using machine learning models, the results suggested that screen content predicted later searches with mental health self-references (AUC = 0·73), mental health self-diagnosis (AUC = 0·69), mental health care seeking (AUC = 0·61), psychoactive medications (AUC = 0·55), suicidal ideation (AUC = 0·58), and suicidal intent (AUC = 0·60). Cox-proportional hazards models suggested individuals utilizing tools with in-person care referral were significantly more likely to subsequently search for methods to actively end their life (HR = 1·727, p = 0·007). Online screens may influence help-seeking behavior, suicidal ideation, and suicidal intent. Websites with referrals to in-person treatments could put persons at greater risk of active suicidal intent. Further evaluation using large-scale randomized controlled trials is needed."
Brain morphometric features predict medication response in youth with bipolar disorder: a prospective randomized clinical trial.,35392995,Melissa P DelBello,University of Cincinnati College of Medicine,Department of Psychiatry and Behavioral Neuroscience,"Identification of treatment-specific predictors of drug therapies for bipolar disorder (BD) is important because only about half of individuals respond to any specific medication. However, medication response in pediatric BD is variable and not well predicted by clinical characteristics. A total of 121 youth with early course BD (acute manic/mixed episode) were prospectively recruited and randomized to 6 weeks of double-blind treatment with quetiapine (<i>n</i> = 71) or lithium (<i>n</i> = 50). Participants completed structural magnetic resonance imaging (MRI) at baseline before treatment and 1 week after treatment initiation, and brain morphometric features were extracted for each individual based on MRI scans. Positive antimanic treatment response at week 6 was defined as an over 50% reduction of Young Mania Rating Scale scores from baseline. Two-stage deep learning prediction model was established to distinguish responders and non-responders based on different feature sets. Pre-treatment morphometry and morphometric changes occurring during the first week can both independently predict treatment outcome of quetiapine and lithium with balanced accuracy over 75% (all <i>p</i> < 0.05). Combining brain morphometry at baseline and week 1 allows prediction with the highest balanced accuracy (quetiapine: 83.2% and lithium: 83.5%). Predictions in the quetiapine and lithium group were found to be driven by different morphometric patterns. These findings demonstrate that pre-treatment morphometric measures and acute brain morphometric changes can serve as medication response predictors in pediatric BD. Brain morphometric features may provide promising biomarkers for developing biologically-informed treatment outcome prediction and patient stratification tools for BD treatment development."
