name,PMID,corresponding_author,university,department,abstract
Identifying the presence and timing of discrete mood states prior to therapy.,32135317,Hannah G Bosley,University of California,N/A,"The present study tested a novel, person-specific method for identifying discrete mood profiles from time-series data, and examined the degree to which these profiles could be predicted by lagged mood and anxiety variables and time-based variables, including trends (linear, quadratic, cubic), cycles (12-hr, 24-hr, and 7-day), day of the week, and time of day. We analyzed ambulatory data from 45 individuals with mood and anxiety disorders prior to therapy. Data were collected four-times-daily for at least 30 days. Latent profile analysis was applied person-by-person to discretize each individual's continuous multivariate time series of rumination, worry, fear, anger, irritability, anhedonia, hopelessness, depressed mood, and avoidance. That is, each time point was classified according to its unique blend of emotional states, and latent classes representing discrete mood profiles were identified for each participant. We found that the modal number of latent classes per person was three (mean = 3.04, median = 3), with a range of two to four classes. After splitting each individual's time series into random halves for training and testing, we used elastic net regularization to identify the temporal and lagged predictors of each mood profile's presence or absence in the training set. Prediction accuracy was evaluated in the testing set. Across 127 models, the average area under the curve was 0.77, with sensitivity of 0.81 and specificity of 0.75. Brier scores indicated an average prediction accuracy of 83%."
What's in a trauma? Using machine learning to unpack what makes an event traumatic.,34378537,Payton J Jones,Harvard University,Department of Psychology,"What differentiates a trauma from an event that is merely upsetting? Wildly different definitions of trauma have been used in both formal (psychiatric) and informal (cultural, colloquial) settings. Yet there is a dearth of empirical work examining the features of events that individuals use to define an event as a 'trauma.' First, a group of qualitative coders classified features (e.g., actual physical injury, loss of possessions) of 600 event descriptions (e.g., ""was verbally harassed by a boss,"" ""watched a video of an adult being shot and killed""). Next, across two studies, machine learning was used to predict whether individuals rated event descriptions as 'trauma' or 'traumatic' in over 100,000 judgment tasks. In Study 1, examining continuous ratings from 'not at all traumatic' to 'extremely traumatic,' a cross-validated LASSO regression with polynomial features provided the best out-of-sample predictions (r<sup>2</sup> = 0.76), outperforming ridge regression, support vector regression, and linear regression. In Study 2, using binary judgments, a random forest model accurately predicted out-of-sample individual responses (AUC = 0.96), outperforming a neural network and an AdaBoost ensemble classifier. The most important event features across the two studies were actual death, threat of death, and the presence of a human perpetrator. The most important human features in predicting judgments were political orientation and gender."
Examining Online Behaviors of Adult-Child and Spousal Caregivers for People Living With Alzheimer Disease or Related Dementias: Comparative Study in an Open Online Community.,37976095,Zhijun Yin,Vanderbilt University,Department of Computer Science,"Alzheimer disease or related dementias (ADRD) are severe neurological disorders that impair the thinking and memory skills of older adults. Most persons living with dementia receive care at home from their family members or other unpaid informal caregivers; this results in significant mental, physical, and financial challenges for these caregivers. To combat these challenges, many informal ADRD caregivers seek social support in online environments. Although research examining online caregiving discussions is growing, few investigations have distinguished caregivers according to their kin relationships with persons living with dementias. Various studies have suggested that caregivers in different relationships experience distinct caregiving challenges and support needs. This study aims to examine and compare the online behaviors of adult-child and spousal caregivers, the 2 largest groups of informal ADRD caregivers, in an open online community. We collected posts from ALZConnected, an online community managed by the Alzheimer's Association. To gain insights into online behaviors, we first applied structural topic modeling to identify topics and topic prevalence between adult-child and spousal caregivers. Next, we applied VADER (Valence Aware Dictionary for Sentiment Reasoning) and LIWC (Linguistic Inquiry and Word Count) to evaluate sentiment changes in the online posts over time for both types of caregivers. We further built machine learning models to distinguish the posts of each caregiver type and evaluated them in terms of precision, recall, F<sub>1</sub>-score, and area under the precision-recall curve. Finally, we applied the best prediction model to compare the temporal trend of relationship-predicting capacities in posts between the 2 types of caregivers. Our analysis showed that the number of posts from both types of caregivers followed a long-tailed distribution, indicating that most caregivers in this online community were infrequent users. In comparison with adult-child caregivers, spousal caregivers tended to be more active in the community, publishing more posts and engaging in discussions on a wider range of caregiving topics. Spousal caregivers also exhibited slower growth in positive emotional communication over time. The best machine learning model for predicting adult-child, spousal, or other caregivers achieved an area under the precision-recall curve of 81.3%. The subsequent trend analysis showed that it became more difficult to predict adult-child caregiver posts than spousal caregiver posts over time. This suggests that adult-child and spousal caregivers might gradually shift their discussions from questions that are more directly related to their own experiences and needs to questions that are more general and applicable to other types of caregivers. Our findings suggest that it is important for researchers and community organizers to consider the heterogeneity of caregiving experiences and subsequent online behaviors among different types of caregivers when tailoring online peer support to meet the specific needs of each caregiver group."
Using machine learning with passive wearable sensors to pilot the detection of eating disorder behaviors in everyday life.,37859600,C A Levinson,University of Louisville,Department of Psychological & Brain Sciences,"Eating disorders (ED) are serious psychiatric disorders, taking a life every 52 minutes, with high relapse. There are currently no support or effective intervention therapeutics for individuals with an ED in their everyday life. The aim of this study is to build idiographic machine learning (ML) models to evaluate the performance of physiological recordings to detect individual ED behaviors in naturalistic settings. From an ongoing study (Final <i>N</i> = 120), we piloted the ability for ML to detect an individual's ED behavioral episodes (e.g. purging) from physiological data in six individuals diagnosed with an ED, all of whom endorsed purging. Participants wore an ambulatory monitor for 30 days and tapped a button to denote ED behavioral episodes. We built idiographic (<i>N</i> = 1) logistic regression classifiers (LRC) ML trained models to identify onset of episodes (~600 windows) v. baseline (~571 windows) physiology (Heart Rate, Electrodermal Activity, and Temperature). Using physiological data, ML LRC accurately classified on average 91% of cases, with 92% specificity and 90% sensitivity. This evidence suggests the ability to build idiographic ML models that detect ED behaviors from physiological indices within everyday life with a high level of accuracy. The novel use of ML with wearable sensors to detect physiological patterns of ED behavior pre-onset can lead to just-in-time clinical interventions to disrupt problematic behaviors and promote ED recovery."
Using Machine Learning of Online Expression to Explain Recovery Trajectories: Content Analytic Approach to Studying a Substance Use Disorder Forum.,37606984,Dhavan Shah,University of Wisconsin-Madison,Department of Psychology,"Smartphone-based apps are increasingly used to prevent relapse among those with substance use disorders (SUDs). These systems collect a wealth of data from participants, including the content of messages exchanged in peer-to-peer support forums. How individuals self-disclose and exchange social support in these forums may provide insight into their recovery course, but a manual review of a large corpus of text by human coders is inefficient. The study sought to evaluate the feasibility of applying supervised machine learning (ML) to perform large-scale content analysis of an online peer-to-peer discussion forum. Machine-coded data were also used to understand how communication styles relate to writers' substance use and well-being outcomes. Data were collected from a smartphone app that connects patients with SUDs to online peer support via a discussion forum. Overall, 268 adult patients with SUD diagnoses were recruited from 3 federally qualified health centers in the United States beginning in 2014. Two waves of survey data were collected to measure demographic characteristics and study outcomes: at baseline (before accessing the app) and after 6 months of using the app. Messages were downloaded from the peer-to-peer forum and subjected to manual content analysis. These data were used to train supervised ML algorithms using features extracted from the Linguistic Inquiry and Word Count (LIWC) system to automatically identify the types of expression relevant to peer-to-peer support. Regression analyses examined how each expression type was associated with recovery outcomes. Our manual content analysis identified 7 expression types relevant to the recovery process (emotional support, informational support, negative affect, change talk, insightful disclosure, gratitude, and universality disclosure). Over 6 months of app use, 86.2% (231/268) of participants posted on the app's support forum. Of these participants, 93.5% (216/231) posted at least 1 message in the content categories of interest, generating 10,503 messages. Supervised ML algorithms were trained on the hand-coded data, achieving F<sub>1</sub>-scores ranging from 0.57 to 0.85. Regression analyses revealed that a greater proportion of the messages giving emotional support to peers was related to reduced substance use. For self-disclosure, a greater proportion of the messages expressing universality was related to improved quality of life, whereas a greater proportion of the negative affect expressions was negatively related to quality of life and mood. This study highlights a method of natural language processing with potential to provide real-time insights into peer-to-peer communication dynamics. First, we found that our ML approach allowed for large-scale content coding while retaining moderate-to-high levels of accuracy. Second, individuals' expression styles were associated with recovery outcomes. The expression types of emotional support, universality disclosure, and negative affect were significantly related to recovery outcomes, and attending to these dynamics may be important for appropriate intervention."
Stress response and experiential avoidance among firefighters: Preliminary insights from network analyses.,37499484,Katharina Schultebraucks,NYU Grossman School of Medicine,Department of Psychiatry,"Firefighters are at increased risk of developing posttraumatic stress disorder (PTSD) due to exposure to potentially traumatic events during their careers. However, little is known about the prevalence of PTSD among this population, particularly when taking moderating variables into account. Using Gaussian Graphical Models and Directed Acyclic Graphs, we conducted network analyses to examine the interactions between clusters of PTSD symptoms, perceived stress, hardiness, and experiential avoidance among 187 firefighters. The data and code are published with the paper. Experiential avoidance, as part of psychological inflexibility, was found to be the only variable that interacted with PTSD symptomatology. Strong positive associations were observed between experiential avoidance and the ""negative mood and cognitions"" subscale of the PTSD Checklist for DSM-5 (PCL-5). Through this association, other PTSD symptoms were activated, particularly avoidance and arousal. Our findings suggest that experiential avoidance and negative mood and cognition symptoms are particularly important in the expression of PTSD symptomatology in firefighters. In addition, experiential avoidance may be used as a coping strategy to reduce perceived stress during potentially traumatic events. Therefore, experiential avoidance may be a prime target for future interventions and training focused on flexible self-regulation strategies in this population."
"Prediction of Attention-Deficit/Hyperactivity Disorder Diagnosis Using Brief, Low-Cost Clinical Measures: A Competitive Model Evaluation.",37205171,Joel T Nigg,Oregon Health & Science University,Division of Psychology,"Proper diagnosis of ADHD is costly, requiring in-depth evaluation via interview, multi-informant and observational assessment, and scrutiny of possible other conditions. The increasing availability of data may allow the development of machine-learning algorithms capable of accurate diagnostic predictions using low-cost measures to supplement human decision-making. We report on the performance of multiple classification methods used to predict a clinician-consensus ADHD diagnosis. Methods ranged from fairly simple (e.g., logistic regression) to more complex (e.g., random forest), while emphasizing a multi-stage Bayesian approach. Classifiers were evaluated in two large (N>1000), independent cohorts. The multi-stage Bayesian classifier provides an intuitive approach consistent with clinical workflows, and was able to predict expert consensus ADHD diagnosis with high accuracy (>86%)-though not significantly better than other methods. Results suggest that parent and teacher surveys are sufficient for high-confidence classifications in the vast majority of cases, while an important minority require additional evaluation for accurate diagnosis."
The relationship between text message sentiment and self-reported depression.,34963643,Lyle H Ungar,University of Pennsylvania,Department of Computer and Information Science,"Personal sensing has shown promise for detecting behavioral correlates of depression, but there is little work examining personal sensing of cognitive and affective states. Digital language, particularly through personal text messages, is one source that can measure these markers. We correlated privacy-preserving sentiment analysis of text messages with self-reported depression symptom severity. We enrolled 219 U.S. adults in a 16 week longitudinal observational study. Participants installed a personal sensing app on their phones, which administered self-report PHQ-8 assessments of their depression severity, collected phone sensor data, and computed anonymized language sentiment scores from their text messages. We also trained machine learning models for predicting end-of-study self-reported depression status using on blocks of phone sensor and text features. In correlation analyses, we find that degrees of depression, emotional, and personal pronoun language categories correlate most strongly with self-reported depression, validating prior literature. Our classification models which predict binary depression status achieve a leave-one-out AUC of 0.72 when only considering text features and 0.76 when combining text with other networked smartphone sensors. Participants were recruited from a panel that over-represented women, caucasians, and individuals with self-reported depression at baseline. As language use differs across demographic factors, generalizability beyond this population may be limited. The study period also coincided with the initial COVID-19 outbreak in the United States, which may have affected smartphone sensor data quality. Effective depression prediction through text message sentiment, especially when combined with other personal sensors, could enable comprehensive mental health monitoring and intervention."
The Hidden Pandemic of Family Violence During COVID-19: Unsupervised Learning of Tweets.,33108315,Tingshao Zhu,Institute of Psychology,N/A,"Family violence (including intimate partner violence/domestic violence, child abuse, and elder abuse) is a hidden pandemic happening alongside COVID-19. The rates of family violence are rising fast, and women and children are disproportionately affected and vulnerable during this time. This study aims to provide a large-scale analysis of public discourse on family violence and the COVID-19 pandemic on Twitter. We analyzed over 1 million tweets related to family violence and COVID-19 from April 12 to July 16, 2020. We used the machine learning approach Latent Dirichlet Allocation and identified salient themes, topics, and representative tweets. We extracted 9 themes from 1,015,874 tweets on family violence and the COVID-19 pandemic: (1) increased vulnerability: COVID-19 and family violence (eg, rising rates, increases in hotline calls, homicide); (2) types of family violence (eg, child abuse, domestic violence, sexual abuse); (3) forms of family violence (eg, physical aggression, coercive control); (4) risk factors linked to family violence (eg, alcohol abuse, financial constraints, guns, quarantine); (5) victims of family violence (eg, the LGBTQ [lesbian, gay, bisexual, transgender, and queer or questioning] community, women, women of color, children); (6) social services for family violence (eg, hotlines, social workers, confidential services, shelters, funding); (7) law enforcement response (eg, 911 calls, police arrest, protective orders, abuse reports); (8) social movements and awareness (eg, support victims, raise awareness); and (9) domestic violence-related news (eg, Tara Reade, Melissa DeRosa). This study overcomes limitations in the existing scholarship where data on the consequences of COVID-19 on family violence are lacking. We contribute to understanding family violence during the pandemic by providing surveillance via tweets. This is essential for identifying potentially useful policy programs that can offer targeted support for victims and survivors as we prepare for future outbreaks."
Detecting mild cognitive impairment and dementia in older adults using naturalistic driving data and interaction-based classification from influence score.,36990588,Guohua Li,Columbia University Mailman School of Public Health,Department of Epidemiology,"Several recent studies indicate that atypical changes in driving behaviors appear to be early signs of mild cognitive impairment (MCI) and dementia. These studies, however, are limited by small sample sizes and short follow-up duration. This study aims to develop an interaction-based classification method building on a statistic named Influence Score (i.e., I-score) for prediction of MCI and dementia using naturalistic driving data collected from the Longitudinal Research on Aging Drivers (LongROAD) project. Naturalistic driving trajectories were collected through in-vehicle recording devices for up to 44 months from 2977 participants who were cognitively intact at the time of enrollment. These data were further processed and aggregated to generate 31 time-series driving variables. Because of high dimensional time-series features for driving variables, we used I-score for variable selection. I-score is a measure to evaluate variables' ability to predict and is proven to be effective in differentiating between noisy and predictive variables in big data. It is introduced here to select influential variable modules or groups that account for compound interactions among explanatory variables. It is explainable regarding to what extent variables and their interactions contribute to the predictiveness of a classifier. In addition, I-score boosts the performance of classifiers over imbalanced datasets due to its association with the F1 score. Using predictive variables selected by I-score, interaction-based residual blocks are constructed over top I-score modules to generate predictors and ensemble learning aggregates these predictors to boost the prediction of the overall classifier. Experiments using naturalistic driving data show that our proposed classification method achieves the best accuracy (96%) for predicting MCI and dementia, followed by random forest (93%) and logistic regression (88%). In terms of F1 score and AUC, our proposed classifier achieves 98% and 87%, respectively, followed by random forest (with an F1 score of 96% and an AUC of 79%) and logistic regression (with an F1 score of 92% and an AUC of 77%). The results indicate that incorporating I-score into machine learning algorithms could considerably improve the model performance for predicting MCI and dementia in older drivers. We also performed the feature importance analysis and found that the right to left turn ratio and the number of hard braking events are the most important driving variables to predict MCI and dementia."
An electroencephalographic signature predicts antidepressant response in major depression.,32042166,Amit Etkin,Stanford University,Department of Psychiatry and Behavioral Sciences,"Antidepressants are widely prescribed, but their efficacy relative to placebo is modest, in part because the clinical diagnosis of major depression encompasses biologically heterogeneous conditions. Here, we sought to identify a neurobiological signature of response to antidepressant treatment as compared to placebo. We designed a latent-space machine-learning algorithm tailored for resting-state electroencephalography (EEG) and applied it to data from the largest imaging-coupled, placebo-controlled antidepressant study (n = 309). Symptom improvement was robustly predicted in a manner both specific for the antidepressant sertraline (versus placebo) and generalizable across different study sites and EEG equipment. This sertraline-predictive EEG signature generalized to two depression samples, wherein it reflected general antidepressant medication responsivity and related differentially to a repetitive transcranial magnetic stimulation treatment outcome. Furthermore, we found that the sertraline resting-state EEG signature indexed prefrontal neural responsivity, as measured by concurrent transcranial magnetic stimulation and EEG. Our findings advance the neurobiological understanding of antidepressant treatment through an EEG-tailored computational model and provide a clinical avenue for personalized treatment of depression."
Fairness in the prediction of acute postoperative pain using machine learning models.,36714611,Patrick J Tighe,University of Florida College of Medicine,Department of Anesthesiology,"Overall performance of machine learning-based prediction models is promising; however, their generalizability and fairness must be vigorously investigated to ensure they perform sufficiently well for all patients. This study aimed to evaluate prediction bias in machine learning models used for predicting acute postoperative pain. We conducted a retrospective review of electronic health records for patients undergoing orthopedic surgery from June 1, 2011, to June 30, 2019, at the University of Florida Health system/Shands Hospital. CatBoost machine learning models were trained for predicting the binary outcome of low (≤4) and high pain (>4). Model biases were assessed against seven protected attributes of age, sex, race, area deprivation index (ADI), speaking language, health literacy, and insurance type. Reweighing of protected attributes was investigated for reducing model bias compared with base models. Fairness metrics of equal opportunity, predictive parity, predictive equality, statistical parity, and overall accuracy equality were examined. The final dataset included 14,263 patients [age: 60.72 (16.03) years, 53.87% female, 39.13% low acute postoperative pain]. The machine learning model (area under the curve, 0.71) was biased in terms of age, race, ADI, and insurance type, but not in terms of sex, language, and health literacy. Despite promising overall performance in predicting acute postoperative pain, machine learning-based prediction models may be biased with respect to protected attributes. These findings show the need to evaluate fairness in machine learning models involved in perioperative pain before they are implemented as clinical decision support tools."
