name,PMID,corresponding_author,university,department,abstract
Development and application of a machine learning-based antenatal depression prediction model.,39848469,Qiong Luo,Women's Hospital,Department of Obstetrics,"Antenatal depression (AND), occurring during pregnancy, is associated with severe outcomes. However, there is a lack of objective and universally applicable prediction methods for AND in clinical practice. We leveraged sociodemographic and pregnancy-related data to develop and validate a machine learning-based AND prediction model. Data from 20,950 pregnant women form 3 hospitals were used and divided into training and test sets. AND was defined as an EPDS score of 10 or above. Using machine learning, we selected 34 characteristic variables and divided them into three categories based on clinical practice: Base Variables, General Variables, and Obstetric Variables. Based on this classification, we constructed four different AND random forest prediction models: the Base Model, the Base+General Model, the Base+Obstetric Model, and the Full Model. The AUC range in the test set was 0.687-0.710. The Base+General Model achieved the best performance with an AUC of 0.710 (95 % CI: 0.693-0.710) in predicting AND risk during the late pregnancy period. The AUC of the Base Model was only 0.022 lower than that of the top-performing model, indicating its solid foundation for early AND screening. We have only analyzed the dataset from two eastern cities, and have not yet validated our models in an external dataset. Machine learning-based prediction models offer the capability to anticipate the risk of AND across different pregnancy stages. This enables the earlier and more accurate identification of pregnant women who may be at risk, facilitating timely interventions for improving outcomes for both mothers and their offspring."
White matter predictors of PTSD: Testing different machine learning models in a sample of Black American women.,37922600,Negar Fani,Emory University School of Medicine,Department of Psychiatry and Behavioral Sciences,"Machine learning neuroimaging studies of posttraumatic stress disorder (PTSD) show promise for identifying neurobiological signatures of PTSD. However, studies to date, have largely evaluated a single machine learning approach, and few studies have examined white matter microstructure as a predictor of PTSD. Further, individuals from minoritized racial groups, specifically, Black individuals, who experience disproportionate trauma frequency, and have relatively higher rates of PTSD, have been underrepresented in these studies. We used four different machine learning models to test white matter microstructure classifiers of PTSD in a sample of trauma-exposed Black American women with and without PTSD. Participants included 45 Black women with PTSD and 89 trauma-exposed controls recruited from an ongoing trauma study. Current PTSD presence was estimated using the Clinician-Administered PTSD Scale. Average fractional anisotropy of 53 white matter tracts served as input features. Additional exploratory analysis incorporated estimates of interpersonal and structural racism exposure. Classification models included linear support vector machine, radial basis function support vector machine, multilayer perceptron, and random forest. Performance varied notably between models. With white matter features along, linear support vector machine demonstrated the best model fit and reached an average AUC = 0.643. Inclusion of estimates of exposure to racism increased linear support vector machine performance (AUC = 0.808). White matter microstructure had limited ability to predict PTSD presence in this sample. These results may indicate that the relationship between white matter microstructure and PTSD may be nuanced across race and gender spectrums."
Early Attrition Prediction for Web-Based Interpretation Bias Modification to Reduce Anxious Thinking: A Machine Learning Study.,39705068,Laura E Barnes,University of Virginia,Department of Systems and Information Engineering,"Digital mental health is a promising paradigm for individualized, patient-driven health care. For example, cognitive bias modification programs that target interpretation biases (cognitive bias modification for interpretation [CBM-I]) can provide practice thinking about ambiguous situations in less threatening ways on the web without requiring a therapist. However, digital mental health interventions, including CBM-I, are often plagued with lack of sustained engagement and high attrition rates. New attrition detection and mitigation strategies are needed to improve these interventions. This paper aims to identify participants at a high risk of dropout during the early stages of 3 web-based trials of multisession CBM-I and to investigate which self-reported and passively detected feature sets computed from the participants interacting with the intervention and assessments were most informative in making this prediction. The participants analyzed in this paper were community adults with traits such as anxiety or negative thinking about the future (Study 1: n=252, Study 2: n=326, Study 3: n=699) who had been assigned to CBM-I conditions in 3 efficacy-effectiveness trials on our team's public research website. To identify participants at a high risk of dropout, we created 4 unique feature sets: self-reported baseline user characteristics (eg, demographics), self-reported user context and reactions to the program (eg, state affect), self-reported user clinical functioning (eg, mental health symptoms), and passively detected user behavior on the website (eg, time spent on a web page of CBM-I training exercises, time of day during which the exercises were completed, latency of completing the assessments, and type of device used). Then, we investigated the feature sets as potential predictors of which participants were at high risk of not starting the second training session of a given program using well-known machine learning algorithms. The extreme gradient boosting algorithm performed the best and identified participants at high risk with macro-F<sub>1</sub>-scores of .832 (Study 1 with 146 features), .770 (Study 2 with 87 features), and .917 (Study 3 with 127 features). Features involving passive detection of user behavior contributed the most to the prediction relative to other features. The mean Gini importance scores for the passive features were as follows: .033 (95% CI .019-.047) in Study 1; .029 (95% CI .023-.035) in Study 2; and .045 (95% CI .039-.051) in Study 3. However, using all features extracted from a given study led to the best predictive performance. These results suggest that using passive indicators of user behavior, alongside self-reported measures, can improve the accuracy of prediction of participants at a high risk of dropout early during multisession CBM-I programs. Furthermore, our analyses highlight the challenge of generalizability in digital health intervention studies and the need for more personalized attrition prevention strategies."
ItpCtrl-AI: End-to-end interpretable and controllable artificial intelligence by modeling radiologists' intentions.,39689443,Ngan Le,University of Arkansas,AICV Lab,"Using Deep Learning in computer-aided diagnosis systems has been of great interest due to its impressive performance in the general domain and medical domain. However, a notable challenge is the lack of explainability of many advanced models, which poses risks in critical applications such as diagnosing findings in CXR. To address this problem, we propose ItpCtrl-AI, a novel end-to-end interpretable and controllable framework that mirrors the decision-making process of the radiologist. By emulating the eye gaze patterns of radiologists, our framework initially determines the focal areas and assesses the significance of each pixel within those regions. As a result, the model generates an attention heatmap representing radiologists' attention, which is then used to extract attended visual information to diagnose the findings. By allowing the directional input, our framework is controllable by the user. Furthermore, by displaying the eye gaze heatmap which guides the diagnostic conclusion, the underlying rationale behind the model's decision is revealed, thereby making it interpretable. In addition to developing an interpretable and controllable framework, our work includes the creation of a dataset, named Diagnosed-Gaze++, which aligns medical findings with eye gaze data. Our extensive experimentation validates the effectiveness of our approach in generating accurate attention heatmaps and diagnoses. The experimental results show that our model not only accurately identifies medical findings but also precisely produces the eye gaze attention of radiologists. The dataset, models, and source code will be made publicly available upon acceptance."
Associations between NIH Toolbox Emotion Battery measures and previous suicide attempt in bipolar I disorder.,39672472,Vincent A Magnotta,The University of Iowa,Department of Radiology,"Suicide attempts are more prevalent in people with bipolar I disorder (BD-I) than in the general population. Most prior studies of suicide in BD-I have focused on separate emotion-related assays or clinician-administered scales, whereas a single, brief, and multidimensional battery of self-report measures has not yet been explored. Here, we utilized the NIH Toolbox Emotion Battery (NIHTB-EB) to assess various emotional measures, determine which were cross-sectionally associated with prior suicide attempt in BD-I, evaluate whether the NIHTB-EB could be used to identify past suicide attempt in BD-I with machine learning, and compare model performance versus using clinical mood scales. The study included 39 participants with BD-I and history of suicide attempt, 48 with BD-I without history of suicide attempt, and 58 controls. We found that 9 of the 17 measures were associated with past suicide attempt in BD-I. The initial random forest model indicated that the most important distinguishing variables were perceived stress, emotional support, anger-hostility, anger-physical aggression, perceived rejection, loneliness, and self-efficacy. Overall, the models utilizing NIHTB-EB measures performed better (69.0 % to 70.1 % accuracy) than the model containing clinical mood scale information without the NIHTB-EB measures (57.5 % accuracy). These findings suggest the NIHTB-EB could be a useful and easy-to-deploy tool in understanding the role of emotion-related measures in suicide in BD-I. Furthermore, these results highlight specific emotional subdomains that could be promising targets for longitudinal studies or interventions aimed at reducing suicide in BD-I."
Using large language models to detect outcomes in qualitative studies of adolescent depression.,39661754,Juan Antonio Lossio-Ventura,National Institute of Mental Health,N/A,"We aim to use large language models (LLMs) to detect mentions of nuanced psychotherapeutic outcomes and impacts than previously considered in transcripts of interviews with adolescent depression. Our clinical authors previously created a novel coding framework containing fine-grained therapy outcomes beyond the binary classification (eg, depression vs control) based on qualitative analysis embedded within a clinical study of depression. Moreover, we seek to demonstrate that embeddings from LLMs are informative enough to accurately label these experiences. Data were drawn from interviews, where text segments were annotated with different outcome labels. Five different open-source LLMs were evaluated to classify outcomes from the coding framework. Classification experiments were carried out in the original interview transcripts. Furthermore, we repeated those experiments for versions of the data produced by breaking those segments into conversation turns, or keeping non-interviewer utterances (monologues). We used classification models to predict 31 outcomes and 8 derived labels, for 3 different text segmentations. Area under the ROC curve scores ranged between 0.6 and 0.9 for the original segmentation and 0.7 and 1.0 for the monologues and turns. LLM-based classification models could identify outcomes important to adolescents, such as friendships or academic and vocational functioning, in text transcripts of patient interviews. By using clinical data, we also aim to better generalize to clinical settings compared to studies based on public social media data. Our results demonstrate that fine-grained therapy outcome coding in psychotherapeutic text is feasible, and can be used to support the quantification of important outcomes for downstream uses."
Brain morphometric features predict medication response in youth with bipolar disorder: a prospective randomized clinical trial.,35392995,Melissa P DelBello,University of Cincinnati College of Medicine,Department of Psychiatry and Behavioral Neuroscience,"Identification of treatment-specific predictors of drug therapies for bipolar disorder (BD) is important because only about half of individuals respond to any specific medication. However, medication response in pediatric BD is variable and not well predicted by clinical characteristics. A total of 121 youth with early course BD (acute manic/mixed episode) were prospectively recruited and randomized to 6 weeks of double-blind treatment with quetiapine (<i>n</i> = 71) or lithium (<i>n</i> = 50). Participants completed structural magnetic resonance imaging (MRI) at baseline before treatment and 1 week after treatment initiation, and brain morphometric features were extracted for each individual based on MRI scans. Positive antimanic treatment response at week 6 was defined as an over 50% reduction of Young Mania Rating Scale scores from baseline. Two-stage deep learning prediction model was established to distinguish responders and non-responders based on different feature sets. Pre-treatment morphometry and morphometric changes occurring during the first week can both independently predict treatment outcome of quetiapine and lithium with balanced accuracy over 75% (all <i>p</i> < 0.05). Combining brain morphometry at baseline and week 1 allows prediction with the highest balanced accuracy (quetiapine: 83.2% and lithium: 83.5%). Predictions in the quetiapine and lithium group were found to be driven by different morphometric patterns. These findings demonstrate that pre-treatment morphometric measures and acute brain morphometric changes can serve as medication response predictors in pediatric BD. Brain morphometric features may provide promising biomarkers for developing biologically-informed treatment outcome prediction and patient stratification tools for BD treatment development."
Using machine learning modeling to identify childhood abuse victims on the basis of personality inventory responses.,39366273,Philip D Harvey,University of Miami Miller School of Medicine,University of Miami Miller School of Medicine,"Trauma is very common and associated with significant co-morbidity world-wide, particularly PTSD and frequently other mental health disorders. However, it can be challenging to identify victims of abuse as self-reports can be difficult to elicit due to emotional distress. Better confirmation of a history of significant mistreatment can assist significantly in treatment planning. We evaluate an alternate approach based on machine-learning techniques applied to personality inventory data (Minnesota Personality Inventory, Adolescent Version; MMPI-A) obtained concurrently to examine convergence with reports of past trauma exposure. The Childhood Trauma Questionnaire (CTQ) was administered to 733 child and adolescent inpatients. Statistical and information-theory measures showed that each type of abuse - sexual, physical, and emotional - had a unique ""fingerprint"" of MMPI-A profiles. In contrast to our previous findings in terms of specific correlations with IQ, individuals positive for Sexual abuse had the fewest MMPI-A elevations, followed by Physical abuse, while those reporting Emotional abuse had the greatest number of elevations. We developed an initial classifier Machine Learning (ML) model for predicting a history of abuse that demonstrates equivalent sensitivity compared to other widely used screening measures. In addition, we show via PCA and cluster analysis that the different levels of severity of emotional abuse present with unique mixtures of personality trait characteristics. Thus, this type of ML mediated analysis could permit at-scale detection of those at potential high risk of a history of abuse by use of real-time information, using a variety of nontransparent data sources."
Characterizing Veteran suicide decedents that were not classified as high-suicide-risk.,39282853,Brian Shiner,White River Junction VA Medical Center,White River Junction VA Medical Center,"Although the Department of Veterans Affairs (VA) has made important suicide prevention advances, efforts primarily target high-risk patients with documented suicide risk, such as suicidal ideation, prior suicide attempts, and recent psychiatric hospitalization. Approximately 90% of VA patients that go on to die by suicide do not meet these high-risk criteria and therefore do not receive targeted suicide prevention services. In this study, we used national VA data to focus on patients that were not classified as high-risk, but died by suicide. Our sample included all VA patients who died by suicide in 2017 or 2018. We determined whether patients were classified as high-risk using the VA's machine learning risk prediction algorithm. After excluding these patients, we used principal component analysis to identify moderate-risk and low-risk patients and investigated demographics, service-usage, diagnoses, and social determinants of health differences across high-, moderate-, and low-risk subgroups. High-risk (<i>n</i> = 452) patients tended to be younger, White, unmarried, homeless, and have more mental health diagnoses compared to moderate- (<i>n</i> = 2149) and low-risk (<i>n</i> = 2209) patients. Moderate- and low-risk patients tended to be older, married, Black, and Native American or Pacific Islander, and have more physical health diagnoses compared to high-risk patients. Low-risk patients had more missing data than higher-risk patients. Study expands epidemiological understanding about non-high-risk suicide decedents, historically understudied and underserved populations. Findings raise concerns about reliance on machine learning risk prediction models that may be biased by relative underrepresentation of racial/ethnic minorities within health system."
"The Normalization of Vaping on TikTok Using Computer Vision, Natural Language Processing, and Qualitative Thematic Analysis: Mixed Methods Study.",39259963,Anna V Wilkinson,University of Texas Health Science Center at Houston School of Public Health,University of Texas Health Science Center at Houston School of Public Health,"Social media posts that portray vaping in positive social contexts shape people's perceptions and serve to normalize vaping. Despite restrictions on depicting or promoting controlled substances, vape-related content is easily accessible on TikTok. There is a need to understand strategies used in promoting vaping on TikTok, especially among susceptible youth audiences. This study seeks to comprehensively describe direct (ie, explicit promotional efforts) and indirect (ie, subtler strategies) themes promoting vaping on TikTok using a mixture of computational and qualitative thematic analyses of social media posts. In addition, we aim to describe how these themes might play a role in normalizing vaping behavior on TikTok for youth audiences, thereby informing public health communication and regulatory policies regarding vaping endorsements on TikTok. We collected 14,002 unique TikTok posts using 50 vape-related hashtags (eg, #vapetok and #boxmod). Using the k-means unsupervised machine learning algorithm, we identified clusters and then categorized posts qualitatively based on themes. Next, we organized all videos from the posts thematically and extracted the visual features of each theme using 3 machine learning-based model architectures: residual network (ResNet) with 50 layers (ResNet50), Visual Geometry Group model with 16 layers, and vision transformer. We chose the best-performing model, ResNet50, to thoroughly analyze the image clustering output. To assess clustering accuracy, we examined 4.01% (441/10,990) of the samples from each video cluster. Finally, we randomly selected 50 videos (5% of the total videos) from each theme, which were qualitatively coded and compared with the machine-derived classification for validation. We successfully identified 5 major themes from the TikTok posts. Vape product marketing (1160/10,990, 8.28%) reflected direct marketing, while the other 4 themes reflected indirect marketing: TikTok influencer (3775/14,002, 26.96%), general vape (2741/14,002, 19.58%), vape brands (2042/14,002, 14.58%), and vaping cessation (1272/14,002, 9.08%). The ResNet50 model successfully classified clusters based on image features, achieving an average F<sub>1</sub>-score of 0.97, the highest among the 3 models. Qualitative content analyses indicated that vaping was depicted as a normal, routine part of daily life, with TikTok influencers subtly incorporating vaping into popular culture (eg, gaming, skateboarding, and tattooing) and social practices (eg, shopping sprees, driving, and grocery shopping). The results from both computational and qualitative analyses of text and visual data reveal that vaping is normalized on TikTok. Our identified themes underscore how everyday conversations, promotional content, and the influence of popular figures collectively contribute to depicting vaping as a normal and accepted aspect of daily life on TikTok. Our study provides valuable insights for regulatory policies and public health initiatives aimed at tackling the normalization of vaping on social media platforms."
From Tweets to Streets: Observational Study on the Association Between Twitter Sentiment and Anti-Asian Hate Crimes in New York City from 2019 to 2022.,39250221,Thu T Nguyen,University of Maryland,Department of Epidemiology & Biostatistics,"Anti-Asian hate crimes escalated during the COVID-19 pandemic; however, limited research has explored the association between social media sentiment and hate crimes toward Asian communities. This study aims to investigate the relationship between Twitter (rebranded as X) sentiment data and the occurrence of anti-Asian hate crimes in New York City from 2019 to 2022, a period encompassing both before and during COVID-19 pandemic conditions. We used a hate crime dataset from the New York City Police Department. This dataset included detailed information on the occurrence of anti-Asian hate crimes at the police precinct level from 2019 to 2022. We used Twitter's application programming interface for Academic Research to collect a random 1% sample of publicly available Twitter data in New York State, including New York City, that included 1 or more of the selected Asian-related keywords and applied support vector machine to classify sentiment. We measured sentiment toward the Asian community using the rates of negative and positive sentiment expressed in tweets at the monthly level (N=48). We used negative binomial models to explore the associations between sentiment levels and the number of anti-Asian hate crimes in the same month. We further adjusted our models for confounders such as the unemployment rate and the emergence of the COVID-19 pandemic. As sensitivity analyses, we used distributed lag models to capture 1- to 2-month lag times. A point increase of 1% in negative sentiment rate toward the Asian community in the same month was associated with a 24% increase (incidence rate ratio [IRR] 1.24; 95% CI 1.07-1.44; P=.005) in the number of anti-Asian hate crimes. The association was slightly attenuated after adjusting for unemployment and COVID-19 emergence (ie, after March 2020; P=.008). The positive sentiment toward Asian tweets with a 0-month lag was associated with a 12% decrease (IRR 0.88; 95% CI 0.79-0.97; P=.002) in expected anti-Asian hate crimes in the same month, but the relationship was no longer significant after adjusting for the unemployment rate and the emergence of COVID-19 pandemic (P=.11). A higher negative sentiment level was associated with more hate crimes specifically targeting the Asian community in the same month. The findings highlight the importance of monitoring public sentiment to predict and potentially mitigate hate crimes against Asian individuals."
