name,PMID,corresponding_author,university,department,abstract
"Decoding HIV Discourse on Social Media: Large-Scale Analysis of 191,972 Tweets Using Machine Learning, Topic Modeling, and Temporal Analysis.",40882217,Angel B Algarin,Edson College of Nursing and Health Innovation,Edson College of Nursing and Health Innovation,"HIV remains a global challenge, with stigma, financial constraints, and psychosocial barriers preventing people living with HIV from accessing health care services, driving them to seek information and support on social media. Despite the growing role of digital platforms in health communication, existing research often narrowly focuses on specific HIV-related topics rather than offering a broader landscape of thematic patterns. In addition, much of the existing research lacks large-scale analysis and predominantly predates COVID-19 and the platform's transition to X (formerly known as Twitter), limiting our understanding of the comprehensive, dynamic, and postpandemic HIV-related discourse. This study aims to (1) observe the dominant themes in current HIV-related social media discourse, (2) explore similarities and differences between theory-driven (eg, literature-informed predetermined categories) and data-driven themes (eg, unsupervised Latent Dirichlet Allocation [LDA] without previous categorization), and (3) examine how emotional responses and temporal patterns influence the dissemination of HIV-related content. We analyzed 191,972 tweets collected between June 2023 and August 2024 using an integrated analytical framework. This approach combined: (1) supervised machine learning for text classification, (2) comparative topic modeling with both theory-driven and data-driven LDA to identify thematic patterns, (3) sentiment analysis using VADER (Valence Aware Dictionary and sEntiment Reasoner) and the NRC Emotion Lexicon to examine emotional dimensions, and (4) temporal trend analysis to track engagement patterns. Theory-driven themes revealed that information and education content constituted the majority of HIV-related discourse (120,985/191,972, 63.02%), followed by opinions and commentary (23,863/191,972, 12.43%), and personal experiences and stories (19,672/191,972, 10.25%). The data-driven approach identified 8 distinct themes, some of which shared similarities with aspects from the theory-driven approach, while others were unique. Temporal analysis revealed 2 different engagement patterns: official awareness campaigns like World AIDS Day generated delayed peak engagement through top-down information sharing, while community-driven events like National HIV Testing Day showed immediate user engagement through peer-to-peer interactions. HIV-related social media discourse on X reflects the dominance of informational content, the emergence of prevention as a distinct thematic focus, and the varying effectiveness of different timing patterns in HIV-related messaging. These findings suggest that effective HIV communication strategies can integrate medical information with community perspectives, maintain balanced content focus, and strategically time messages to maximize engagement. These insights provide valuable guidance for developing digital outreach strategies that better connect healthcare services with vulnerable populations in the post-COVID-19 pandemic era."
Social Media Insights Into Disease Burden in Patients and Caregivers of Myelodysplastic Syndrome: Subcohort Analysis of High-Risk Patients.,40844074,Cosmina Hogea,Gilead Sciences Inc,N/A,"Social media platforms offer valuable insights into patients' experience, revealing organic conversations that reflect their immediate concerns and needs. Through active listening to lived experiences, we can identify unmet needs and discover the real-world challenges that patients and caregivers face. The aim of our study is to develop a reusable framework to collect and analyze evolving social media data, capturing insights into the experiences of individuals with myelodysplastic syndromes (MDS) and higher-risk MDS and their caregivers. The findings can inform the development of appropriate patient support interventions. We conducted a structured Google search of English-language websites relevant to MDS from January 1, 2008, to December 31, 2022, using validated URLs and keywords. Data were sourced from MDS-specific platforms to ensure clinical relevance. Contextual embeddings (rather than simple keyword matching) were applied to detect semantically meaningful mentions of ""MDS."" Scraping algorithms collected, cleaned, and standardized the data. Posts were classified as originating from patients or caregivers using decision-tree tagging based on contextual summaries. Users were categorized as HR-MDS based on explicit mentions of ""high-risk"" or by referencing criteria aligned with National Comprehensive Cancer Network guidelines (eg, blast count, transplant, chemotherapy use). Each post was analyzed for major themes and sentiment using a supervised machine learning classifier, while latent topics were identified through a semisupervised model. We analyzed ~5.5 million words from 42,000 posts across 5500 threads by ~4000 users from the United States, United Kingdom, and Canada. Of the 1249 HR-MDS users identified, 587 (47%) were patients and 662 (53%) were caregivers. Dominant sentiments among HR-MDS users included concern (n=974, 78%), anxiety (n=749, 60%), frustration (n=724, 58%), fear (n=724, 58%), and confusion (n=612, 49%). Concern was the top sentiment among caregivers (n=390, 59%), while anxiety led among patients (n=323, 55%). Key topics included blood counts (n=674, 54%), disease burden (n=537, 43%), quality of life (n=450, 36%), treatment options (n=387, 31%), and disease progression (n=387, 31%). Anxiety was frequently tied to health (n=600, 48%), treatment (n=325, 26%), and the diagnostic process (n=250, 20%). Fear stemmed from complications (n=237, 19%) and progression (n=240, 19%). Confusion about diagnosis and disease understanding was reported by 300 (24%). Information-seeking behaviors revealed user interest in treatment interventions (n=238, 19%) and ongoing research (n=212, 17%). The application of sophisticated natural language processing techniques demonstrates promise in effectively identifying the emerging complex themes and sentiments experienced by HR-MDS users, thereby highlighting the unmet needs, barriers, and facilitators associated with the disease."
Use of Mobile Sensing Data for Longitudinal Monitoring and Prediction of Depression Severity: Systematic Review.,40839863,Hanna Reich,University Hospital,Department for Psychiatry,"Depression is highly recurrent and heterogeneous. The unobtrusive, continuous collection of mobile sensing data via smartphones and wearable devices offers a promising approach to monitor and predict individual depression trajectories, distinguish illness states, and anticipate changes in symptom severity. This systematic review evaluates whether objective data from wearable devices and smartphones can (1) monitor and distinguish different states of depression, (2) predict changes in symptom severity, and (3) identify clinically relevant objective features for tracking and forecasting depression within diagnosed individuals. We searched PubMed and Web of Science databases for English-language studies (published 2012-2022) that used smartphone or wearable device data, included participants aged ≥14 years with a depression diagnosis, and collected continuous data for at least 12 weeks. Out of 12,997 peer-reviewed articles, 9 original studies met the inclusion criteria, with sample sizes ranging from 45 to 2200 and durations of 12-52 weeks. Of the 9 studies, 3 used smartphone data, 1 used wearable device data, and 5 used both data types. Commonly collected variables were step count, distance moved, smartphone usage, call logs, sleep, heart rate, light exposure, and speech patterns. One study (11%) successfully differentiated between depressive states (worsening, relapse, or recovery). Six studies (67%) showed that mobile sensing data could predict depressive episodes or symptom severity. Four studies reported the predictive accuracy for depression using mobile sensing data from smartphones and wearable devices, ranging from 81% to 91%. Higher accuracy was achieved with personalized models or multimodal data. Real-time passive monitoring via wearable devices and smartphones holds promise for personalized self-management, but key gaps remain, such as a lack of longitudinal and long-term studies with data collection for 1 year or longer, studies with confirmatory parameters on an individual level, and studies with a strong correlation between parameters in individual patients to support clinical decision-making. Improvements in reporting standards are highly recommended to provide better-informed insights for clinicians. Throughout this process, there is a clear need to address various other issues, such as limited types of collected data, reliability, user adherence, and privacy concerns. PROSPERO CRD42022355696; https://www.crd.york.ac.uk/PROSPERO/view/CRD42022355696."
"Exploring the Perspectives of Pediatric Health Care Providers, Youth Patients, and Caregivers on Machine Learning Suicide Risk Classification: Mixed Methods Study.",40829141,Emily E Haroz,Johns Hopkins University,Department of Mental Health,"Suicide was the second leading cause of death for youth aged between 10 and 24 years in 2023, necessitating improved risk identification to better identify those in need of support. While machine learning (ML) applied to electronic health records shows promise in improving risk identification, further research on the perspectives of these tools is needed to better inform implementation strategies. These findings incorporate 2 studies aimed to explore patient, caregiver, and pediatric health care provider perspectives on suicide risk models and associated clinical practices. We sought to use these findings to inform the design and implementation of a suicide risk model and associated clinical workflow to improve the quality of care provided to at-risk youth. We conducted a convergent mixed methods study to evaluate pediatric provider perspectives by quantitatively surveying and qualitatively interviewing provider participants. The provider study was guided by the Consolidated Framework for Implementation Research, and data were analyzed descriptively and using a template analysis for quantitative and qualitative data, respectively. Qualitative interviews conducted among youth patients and caregivers as part of a sequential mixed methods study, guided by the Theoretical Framework of Acceptability, were analyzed using template analysis as well. The integration of quantitative and qualitative data was achieved through a joint display, and results were interpreted through a narrative review. Forty-five providers completed the first section of the survey (risk model clinical preferences), while 44 completed the second section (risk model usability perspectives) and 38 completed the third section (Consolidated Framework for Implementation Research barriers and facilitators). Eight pediatric providers were interviewed. Ten semistructured qualitative interviews were conducted among 9 patient participants aged between 8 and 25 years and 1 caregiver. Overall, providers, patients, and caregivers expressed interest in applying ML methods to improve suicide risk identification. Providers felt that these tools could address current challenges in suicide-related care, such as inadequacies in manual suicide screeners or communication across care teams. Patients and caregivers saw potential for these tools to facilitate discussions regarding suicide and promote early intervention for patients who might otherwise be missed by current care practices. However, providers also expressed concerns about increased demand for mental health services, implications for patient confidentiality, coercive care, inaccurate diagnosis and response, and medical-legal liability. Ethical concerns shared by patients and caregivers spanned data safety practices and privacy regulations, respect for patient autonomy and informed consent, and decreased future health care engagement due to poor implementation. There is conditional acceptability and enthusiasm among providers, patients, and caregivers for ML-based suicide risk models. Successful implementation requires the incorporation of provider perspectives in a user-led fashion to build trust and empower clinicians to respond appropriately to risk flags, while upholding youth and caregiver perspectives to adequately accommodate patient needs."
Machine learning approaches to predicting medication nonadherence: a scoping review.,40819415,Jeffery Talbert,University of Kentucky College of Medicine,University of Kentucky College of Medicine,"Medication nonadherence is a common, preventable cause of adverse clinical outcomes. Predictive models identifying risk of nonadherence could enable proactive intervention. This scoping review aimed to describe relevant predictors, model training and evaluation processes, and how adherence was classified to inform implementation of clinically actionable models. A systematic search of PubMed, Embase, and Web of Science was conducted for studies published between January 2015 and December 2024 describing creation of models predictive of future medication adherence using machine learning methods. Conference abstracts, review articles, study protocols, or full text articles unavailable to authors were excluded. Data was extracted and study risk of bias assessed by an investigator-specified scale. Quantitative analysis was performed in studies reporting area under receiver operating characteristic curve (AUC), analyzing characteristics of the model with the highest reported AUC (""primary model"") per study. 52 studies were included, of which 14 were considered low risk of bias, 34 moderate, and 4 high. 9 did not report AUC and were excluded from quantitative analysis. Adherence was most frequently assessed using indirect, dispense history-based methods such as proportion of days covered. Primary models incorporating diagnostic or subject-reported data had higher median AUC (diagnostic 0.837; subject-reported 0.828; overall 0.82). Common important predictors included the Beliefs about Medicines questionnaire, comorbidities, medication history, prior adherence and socioeconomic factors. Random forest and logistic regression models were identified as the highest performing models most frequently. Approaches to modeling and evaluating adherence prediction were highly variable, however several successful algorithms, predictors, and training techniques were identified. Future research should prioritize operational feasibility and clinical utility in development of predictive models to ensure creation of effective clinical decision support tools."
The sleep-anxiety dysregulation model of alcohol use disorder risk: A nine-year longitudinal machine learning study.,40774510,Natalia Van Doren,University of California at San Francisco,Department of Psychiatry and Behavioral Sciences,"Sleep disturbances are a known risk factor for alcohol use, yet their long-term predictive value for alcohol use disorder (AUD)-especially in the context of co-occurring anxiety symptoms-remains understudied. The present study thus applied machine learning with internal validation to evaluate how sleep disturbances predict nine-year AUD symptoms in midlife adults. It also introduces the Sleep-Anxiety Dysregulation Model of AUD Risk, which posits that sleep and anxiety symptoms confer shared vulnerability via disrupted arousal regulation. Community-dwelling midlife adults (N = 1,054) completed clinical interviews, self-reports, and a seven-day actigraphy protocol to assess demographics, psychiatric symptoms, anxiety severity, subjective sleep, and objective actigraphy sleep indices. A five-fold nested cross-validated random forest identified potentially nonlinear and interactive predictors. The baseline model included 41 variables. The final multivariable model explained over two-fifths of the variance in nine-year AUD symptoms (R<sup>2</sup> = 42.7%, 95% confidence intervals [40.1%-45.8%]). Key baseline predictors of nine-year AUD severity included lower rest-stage activity, sleep discontinuity and fragmentation patterns, and decreased active wake-stage physical movement. Other baseline predictors comprised younger age, higher generalized anxiety disorder, major depression, and panic disorder severity. No subjective sleep disturbances predicted nine-year AUD symptoms. Results underscore the shared contribution of sleep and anxiety disturbances to long-term AUD risk. The proposed Sleep-Anxiety Dysregulation Model of AUD Risk offers an integrative framework suggesting that AUD symptoms may emerge via chronic arousal dysregulation, including heightened physiological reactivity. Externally validating this model may inform preventive strategies targeting distal risk processes underlying AUD."
Towards large language models with human-like episodic memory.,40713240,Sebastian Michelmann,New York University,Department of Psychology,"Cognitive neuroscience research has made tremendous progress over the past decade in addressing how episodic memory (EM; memory for unique past experiences) supports our ability to understand real-world events. Despite this progress, we still lack a computational modeling framework that is able to generate precise predictions regarding how EM will be used when processing high-dimensional naturalistic stimuli. Recent work in machine learning that augments large language models (LLMs) with external memory could potentially accomplish this, but current popular approaches are misaligned with human memory in various ways. This review surveys these differences, suggests criteria for benchmark tasks to promote alignment with human EM, and ends with potential methods to evaluate predictions from memory-augmented models using neuroimaging techniques."
Using Machine Learning of Online Expression to Explain Recovery Trajectories: Content Analytic Approach to Studying a Substance Use Disorder Forum.,37606984,Dhavan Shah,University of Wisconsin-Madison,Department of Psychology,"Smartphone-based apps are increasingly used to prevent relapse among those with substance use disorders (SUDs). These systems collect a wealth of data from participants, including the content of messages exchanged in peer-to-peer support forums. How individuals self-disclose and exchange social support in these forums may provide insight into their recovery course, but a manual review of a large corpus of text by human coders is inefficient. The study sought to evaluate the feasibility of applying supervised machine learning (ML) to perform large-scale content analysis of an online peer-to-peer discussion forum. Machine-coded data were also used to understand how communication styles relate to writers' substance use and well-being outcomes. Data were collected from a smartphone app that connects patients with SUDs to online peer support via a discussion forum. Overall, 268 adult patients with SUD diagnoses were recruited from 3 federally qualified health centers in the United States beginning in 2014. Two waves of survey data were collected to measure demographic characteristics and study outcomes: at baseline (before accessing the app) and after 6 months of using the app. Messages were downloaded from the peer-to-peer forum and subjected to manual content analysis. These data were used to train supervised ML algorithms using features extracted from the Linguistic Inquiry and Word Count (LIWC) system to automatically identify the types of expression relevant to peer-to-peer support. Regression analyses examined how each expression type was associated with recovery outcomes. Our manual content analysis identified 7 expression types relevant to the recovery process (emotional support, informational support, negative affect, change talk, insightful disclosure, gratitude, and universality disclosure). Over 6 months of app use, 86.2% (231/268) of participants posted on the app's support forum. Of these participants, 93.5% (216/231) posted at least 1 message in the content categories of interest, generating 10,503 messages. Supervised ML algorithms were trained on the hand-coded data, achieving F<sub>1</sub>-scores ranging from 0.57 to 0.85. Regression analyses revealed that a greater proportion of the messages giving emotional support to peers was related to reduced substance use. For self-disclosure, a greater proportion of the messages expressing universality was related to improved quality of life, whereas a greater proportion of the negative affect expressions was negatively related to quality of life and mood. This study highlights a method of natural language processing with potential to provide real-time insights into peer-to-peer communication dynamics. First, we found that our ML approach allowed for large-scale content coding while retaining moderate-to-high levels of accuracy. Second, individuals' expression styles were associated with recovery outcomes. The expression types of emotional support, universality disclosure, and negative affect were significantly related to recovery outcomes, and attending to these dynamics may be important for appropriate intervention."
Longitudinal Digital Phenotyping of Multiple Sclerosis Severity Using Passively Sensed Behaviors and Ecological Momentary Assessments: Real-World Evaluation.,40459924,Mayank Goel,Carnegie Mellon University,School of Computer Science,"Longitudinal tracking of multiple sclerosis (MS) symptoms in an individual's environment may improve self-monitoring and clinical management for people with MS. Conventional symptom tracking methods rely on self-reports and clinical visits, which can be infrequent, subjective, and burdensome. Digital phenotyping using passively collected sensor data from smartphones and fitness trackers offers a promising alternative for continuous, real-time symptom monitoring with minimal patient burden. We aimed to develop and evaluate a machine learning (ML)-based digital phenotyping approach to monitor the severity of clinically-relevant MS symptoms. We used passive sensing data to predict short-term fluctuations in patient-reported symptoms, including depressive symptoms, global MS symptom burden, severe fatigue, and poor sleep quality. Further, we examined the impact of incorporating behavioral context features and ecological momentary assessments on prediction performance. We conducted a 12- to 24-week longitudinal study involving 104 people with MS, collecting passive sensor and behavioral health data. Smartphone sensors recorded call activity, location, and screen use, while fitness trackers captured heart rate, sleep patterns, and step count. We extracted patient-level behavioral features and categorized them into 2 feature sets: one from the prediction period (called action) and one from the preceding period (called context). Using an ML pipeline based on support vector machines and AdaBoost, we evaluated the predictive performance of sensor-based models, both with and without ecological momentary assessment inputs. Between November 16, 2019, and January 24, 2021, overall, 104 people with MS (women: n=88, 84.6%; non-Hispanic White: n=97, 93.3%; mean age 44, SD 11.8 years) from a clinic-based cohort completed 12 weeks of data collection, including a subset of 44 participants (women: n=39, 89%; non-Hispanic White: n=42, 95%; mean age 45.7, SD 11.2 years) who completed 24 weeks of data collection. In total, we collected approximately 12,500 days of passive sensor and behavioral health data from the participants. Among the best-performing models with the least sensor data requirement, the ML algorithm predicted depressive symptoms with an accuracy of 80.6% (F<sub>1</sub>-score=0.76), high global MS symptom burden with an accuracy of 77.3% (F<sub>1</sub>-score=0.78), severe fatigue with an accuracy of 73.8% (F<sub>1</sub>-score=0.74), and poor sleep quality with an accuracy of 72.0% (F<sub>1</sub>-score=0.70). Further, sensor data were largely sufficient for predicting symptom severity, while the prediction of depressive symptoms benefited from minimal active patient input in the form of responses to 2 brief questions on the day before the prediction point. Our digital phenotyping approach using passive sensors on smartphones and fitness trackers may help patients with real-world, continuous self-monitoring of common symptoms in their own environment and assist clinicians with better triage of patient needs for timely interventions in MS and potentially other chronic neurological disorders."
